"English","French"
"He stole money.","Il a {{c::volé}} de l'argent."
"I was born on {{c::april}} 3, 1950.","Je suis née le 3 avril 1950."
"I was born on april 3, 1950.","Je suis née le 3 {{c::avril}} 1950."
"I am to your left.","Je suis à votre {{c::gauche}}."
"I was born on {{c::january}} 2 in 1968.","Je suis née le 2 janvier 1968."
"I was born on january 2 in 1968.","Je suis née le 2 {{c::janvier}} 1968."
"Do you have them?","Tu les {{c::as}} ?"
"I don't have many friends.","Je n'ai pas beaucoup {{c::d'amis}}."
"I did that {{c::yesterday}}.","Je l'ai fait hier."
"{{c::crime}} doesn't pay.","Le crime ne paie pas."
"Crime doesn't pay.","Le crime ne {{c::paie}} pas."
"{{c::crime}} does not pay.","Le crime ne paie pas."
"They hate him.","Elles le {{c::détestent}}."
"I can hear you {{c::loud}} and clear.","Je t'entends très bien."
"{{c::knock}} on the door.","Frappe à la porte !"
"Tom isn't rude.","Tom n'est pas {{c::grossier}}."
"What is {{c::destiny}}?","Qu'est-ce que le destin ?"
"What is destiny?","Qu'est-ce que le {{c::destin}} ?"
"I'm going to the {{c::cinema}}.","Je vais au cinéma."
"I'm going to the cinema.","Je vais au {{c::cinéma}}."
"What's latin?","Qu'est-ce que le {{c::latin}} ?"
"I'm at your {{c::service}}.","Je suis à votre service."
"I am at your {{c::service}}.","Je suis à votre service."
"Let me give you an {{c::example}}.","Je vous donne un exemple."
"Let me give you an example.","Je vous donne un {{c::exemple}}."
"Tom isn't friendly.","Tom n'est pas {{c::amical}}."
"Tom isn't {{c::reliable}}.","Tom n'est pas fiable."
"Tom isn't an {{c::adult}}.","Tom n'est pas adulte."
"I know i can do that.","Je sais {{c::pouvoir}} le faire."
"{{c::crime}} does not pay.","Le crime ne paye pas."
"Crime does not pay.","Le crime ne {{c::paye}} pas."
"Tom is unambitious.","Tom n'est pas {{c::ambitieux}}."
"They see him.","Elles le {{c::voient}}."
"I'm offering you a job.","Je vous {{c::offre}} un emploi."
"I know that i've helped you.","Je sais que je t'ai {{c::aidé}}."
"I want to be invited.","Je veux être {{c::invitée}}."
"I'm out of {{c::options}}.","Je n'ai plus le choix."
"I'm going to the {{c::concert}}.","Je vais au concert."
"I'm going to the concert.","Je vais au {{c::concert}}."
"I want to be an {{c::actor}}.","Je veux être acteur."
"I want to be an actor.","Je veux être {{c::acteur}}."
"Tom isn't {{c::trained}}.","Tom n'est pas formé."
"Tom isn't trained.","Tom n'est pas {{c::formé}}."
"Tom is unmoved.","Tom n'est pas {{c::ému}}."
"Tom is overjoyed.","Tom est fou de {{c::joie}}."
"Tom didn't {{c::appear}}.","Tom n'est pas apparu."
"Tom isn't a {{c::racist}}.","Tom n'est pas raciste."
"Tom isn't an {{c::interpreter}}.","Tom n'est pas interprète."
"Tom isn't a {{c::minor}}.","Tom n'est pas mineur."
"Tom is {{c::resourceful}}.","Tom est plein de ressources."
"Tom is resourceful.","Tom est plein de {{c::ressources}}."
"I practice sports.","Je fais du {{c::sport}}."
"I want to be cool.","Je veux être {{c::cool}}."
"Don't touch the {{c::stove}}.","Ne touche pas le poêle."
"I will {{c::sue}} you.","Je vous ferai un procès."
"I'll {{c::sue}} you.","Je vous ferai un procès."
"I want to be an {{c::actor}}.","Je veux être actrice."
"I want to be an actor.","Je veux être {{c::actrice}}."
"You cannot buy {{c::happiness}}.","Le bonheur ne s'achète pas."
"Tom is merciful.","Tom est plein de {{c::compassion}}."
"Don't you see the pattern?","Ne vois-tu pas le {{c::modèle}} ?"
"Tom's {{c::charming}}.","Tom est plein de charme."
"Tom's charming.","Tom est plein de {{c::charme}}."
"Tom is {{c::charming}}.","Tom est plein de charme."
"Tom is charming.","Tom est plein de {{c::charme}}."
"{{c::knock}} on the door.","Frappez à la porte !"
"I want to see, too!","Je veux voir {{c::aussi}} !"
"Stop the {{c::train}}.","Arrête le train."
"I want to be {{c::respected}}.","Je veux être respecté."
"I want to be respected.","Je veux être {{c::respecté}}."
"The {{c::engine}} won't start.","Le moteur ne démarre pas."
"I'm working {{c::harder}}.","Je travaille plus dur."
"I'm working harder.","Je travaille plus {{c::dur}}."
"I don't care about {{c::fashion}}.","Je n'ai cure de la mode."
"I don't have many friends.","Je n'ai pas beaucoup {{c::d'amies}}."
"I want to be {{c::promoted}}.","Je veux être promu."
"I'm perfect for you.","Je suis {{c::parfaite}} pour vous."
"I don't have a lot of {{c::options}}.","Je n'ai pas beaucoup d'options."
"Don't push it.","Ne pousse pas le {{c::bouchon}} !"
"Don't touch the {{c::stove}}.","Ne touchez pas le poêle."
"I'm doing my duty.","Je fais mon {{c::devoir}}."
"He's not {{c::worthy}} of you.","Il n'est pas digne de vous."
"He's not worthy of you.","Il n'est pas {{c::digne}} de vous."
"Don't translate it {{c::literally}}.","Ne le traduis pas littéralement."
"Tom is guilty of {{c::stealing}}.","Tom est coupable de vol."
"I'm at your {{c::disposal}}.","Je suis à votre disposition."
"Let me see it.","{{c::laisse-moi}} le voir."
"What do the people want?","Que veut le {{c::peuple}} ?"
"Don't speak ill of him in {{c::public}}.","Ne le dénigre pas publiquement."
"This isn't music.","Ce n'est pas de la {{c::musique}}."
"It is wrong to tell {{c::lies}}.","C'est mal de mentir."
"Tom is a mountain guide.","Tom est {{c::guide}} de montagne."
"I go to the {{c::theatre}}.","Je vais au théâtre."
"I go to the theatre.","Je vais au {{c::théâtre}}."
"I'm {{c::anxious}} to see you.","Je suis impatient de vous voir."
"He has big problems.","Il a de gros {{c::problèmes}}."
"I'm under the {{c::blanket}}.","Je suis sous la couverture."
"I'm under the blanket.","Je suis sous la {{c::couverture}}."
"He gave up {{c::cigarettes}}.","Il a arrêté de fumer."
"I'm going to the {{c::center}} of the city.","Je vais au centre-ville."
