"English","French"
"Tom didn't like the {{1::picnic}}.","Tom n'a pas apprécié le pique-nique."
"Tom didn't like the picnic.","Tom n'a pas apprécié le {{1::pique-nique}}."
"He's in {{1::grave}} danger.","Il est en danger grave."
"I'm going to check my {{1::calendar}}.","Je vais voir mon agenda."
"Don't forget to take your {{1::pills}}.","N'oubliez pas de prendre votre pilule !"
"He was born in {{1::switzerland}}.","Il est né en suisse."
"There's an {{1::emergency}}.","Il y a une urgence."
"There's a condition.","Il y a une {{1::condition}}."
"He was born in {{1::africa}}.","Il est né en afrique."
"He was born in africa.","Il est né en {{1::afrique}}."
"There is a {{1::strike}}.","Il y a une grève."
"We thought tom was asleep.","Nous {{1::pensions}} que tom dormait."
"I'm glad to make your {{1::acquaintance}}.","Je suis ravi de faire votre connaissance."
"I'm very happy with my {{1::purchase}}.","Je suis très satisfait de mon achat."
"I got wet to the {{1::skin}}.","Je suis trempé jusqu'aux os."
"My {{1::hobby}} is music.","Mon passe-temps est la musique."
"My hobby is music.","Mon {{1::passe-temps}} est la musique."
"I'm so proud of my team.","Je suis si fier de mon {{1::équipe}}."
"I wish to speak with you in {{1::private}}.","Je désire vous parler en privé."
"Tom is taking a walk.","Tom fait une {{1::promenade}}."
"Don't forget your {{1::mother's}} birthday!","N'oubliez pas l'anniversaire de votre mère !"
"Do your best in everything.","{{1::donnez}} en tout le meilleur de vous."
"I just got a call from the hospital.","Je viens d'avoir un {{1::appel}} de l'hôpital."
"I {{1::handed}} the mike to him.","Je lui ai donné le micro."
"I ran into a {{1::pole}}.","Je suis rentré dans un poteau."
"Tom had {{1::jeans}} on.","Tom portait un jean."
"Tom had jeans on.","Tom portait un {{1::jean}}."
"I know how the system works.","Je sais comment fonctionne le {{1::système}}."
"The same {{1::holds}} true for germany.","Il en est de même pour l'allemagne."
"The same holds true for germany.","Il en est de même pour {{1::l'allemagne}}."
"That boy has good {{1::brains}}.","Ce garçon est intelligent."
"Are you really not going?","N'y {{1::allez-vous}} vraiment pas ?"
"I had to get some money.","J'ai dû {{1::obtenir}} de l'argent."
"Tom is making a {{1::video}}.","Tom fait une vidéo."
"Tom is making a video.","Tom fait une {{1::vidéo}}."
"We {{1::subscribe}} to a newspaper.","Nous souscrivons à un journal."
"Happiness does not consist simply in wealth.","Le bonheur ne vient pas que de la {{1::richesse}}."
"He is a {{1::medical}} student.","Il est étudiant en médecine."
"He is a medical student.","Il est étudiant en {{1::médecine}}."
"I can do it in a week.","Je peux le faire en une {{1::semaine}}."
"I'm stuck in a traffic jam.","Je suis coincé dans un {{1::embouteillage}}."
"I don't understand the meaning of this {{1::phrase}}.","Je ne comprends pas le sens de cette phrase."
"Does the {{1::keyboard}} work?","Est-ce que le clavier fonctionne ?"
"Does the keyboard work?","Est-ce que le {{1::clavier}} fonctionne ?"
"What do you think of mary's new dress?","Que penses-tu de la nouvelle {{1::robe}} de mary ?"
"I ran into a {{1::pole}}.","Je suis rentrée dans un poteau."
"Never did i see him again.","Je ne l'ai plus jamais {{1::revu}}."
"I have been waiting for you for five {{1::hours}}!","Cela fait 5 heures que je t’attends !"
"She thinks {{1::highly}} of him.","Elle pense beaucoup de bien de lui."
"I'm in the middle of something.","Je suis au {{1::milieu}} de quelque chose."
"{{1::youth}} is like the wind.","La jeunesse est comme le vent."
"Youth is like the wind.","La {{1::jeunesse}} est comme le vent."
"I am in {{1::search}} of the lost language.","Je suis à la recherche de la langue perdue."
"Father doesn't allow me to drive.","Père ne me {{1::permet}} pas de conduire."
"This wall {{1::feels}} cold.","Ce mur est froid."
"This wall feels cold.","Ce {{1::mur}} est froid."
"This {{1::wall}} is cold.","Ce mur est froid."
"This wall is cold.","Ce {{1::mur}} est froid."
"Who's the letter {{1::addressed}} to?","À qui est adressée la lettre ?"
"Who is the better hunter?","Qui est le meilleur {{1::chasseur}} ?"
"Water is {{1::indispensable}} to us.","L'eau nous est indispensable."
"Water is indispensable to us.","L'eau nous est {{1::indispensable}}."
"I will show you some.","Je vais vous en montrer {{1::quelques-uns}}."
"Tom's dog has four legs.","Le chien de tom a quatre {{1::pattes}}."
"Come {{1::into}} the room.","Entre dans la pièce."
"Come into the room.","{{1::entre}} dans la pièce."
"I'm a dead duck!","Je suis fait comme un {{1::rat}} !"
"Did tom say where?","Tom a donné le nom de {{1::l'endroit}} ?"
"And what should we do?","Et que {{1::devrions-nous}} faire ?"
"I must make up for lost time.","Je dois {{1::rattraper}} le temps perdu."
"This coffee shop is cozy.","Ce café est {{1::confortable}}."
"Tom has beautiful blue eyes.","Tom a de {{1::magnifiques}} yeux bleus."
"This coffee is bitter.","Ce café est {{1::amer}}."
"It skyrocketed.","Il est monté en {{1::flèche}}."
"She cares about your {{1::safety}}.","Elle s'inquiète de ta sécurité."
"She {{1::lowered}} her voice.","Elle a baissé la voix."
"It smells like fish.","Ça {{1::sent}} le poisson."
"Not now, then when?","Pas maintenant, {{1::alors}} quand ?"
"My {{1::hobby}} is to cook.","Mon passe-temps est la cuisine."
"My hobby is to cook.","Mon {{1::passe-temps}} est la cuisine."
"The {{1::curry}} at this restaurant is good.","Le curry de ce restaurant est bon."
"He likes {{1::seafood}}.","Il apprécie les fruits de mer."
"Tom is not fond of {{1::pets}}.","Tom n'aime pas les animaux de compagnie."
"I want to talk to you about tomorrow.","Je veux vous parler à {{1::propos}} de demain."
"Who do you think the murderer is?","Qui, pensez-vous, est le {{1::meurtrier}} ?"
"This is the {{1::main}} street of this city.","C'est la rue principale de la ville."
"This is the main street of this city.","C'est la rue {{1::principale}} de la ville."
"The television is {{1::brand}} new.","Le téléviseur est tout neuf."
"I don't think anything {{1::changes}}.","Je ne crois pas que les choses changent."
"I don't think anything changes.","Je ne crois pas que les choses {{1::changent}}."
"I don't know if {{1::george}} is coming.","Je ne sais pas si george vient."
"I don't know if george is coming.","Je ne sais pas si {{1::george}} vient."
"Does truth matter?","Est-ce que la vérité {{1::importe}} ?"
"You're learning english.","Vous {{1::apprenez}} l'anglais."
"I need to make a lot of changes.","J'ai besoin de faire beaucoup de {{1::changements}}."
"This is the best restaurant i know of.","C'est le meilleur restaurant que je {{1::connaisse}}."
"The house is on fire.","La maison est en train de {{1::brûler}}."
"The house is burning.","La maison est en train de {{1::brûler}}."
"The house is burning!","La maison est en train de {{1::brûler}} !"
"They adore tom.","Elles {{1::adorent}} tom."
