"English","French"
"His name is {{c::michael}}.","Son nom est michael."
"I've been working since i was {{c::thirteen}}.","Je travaille depuis que j'ai treize ans."
"I put my hand on his shoulder.","Je mis la main sur son {{c::épaule}}."
"I put my hand on her shoulder.","Je mis la main sur son {{c::épaule}}."
"This salad tastes of lemon.","Cette salade a un goût de {{c::citron}}."
"We lost by two points.","Nous avons perdu de deux {{c::points}}."
"Quit {{c::behaving}} like a kid.","Cessez de vous conduire comme un enfant !"
"Is that an order?","Est-ce une {{c::commande}} ?"
"You like {{c::olives}}, don't you?","Tu aimes les olives, n'est-ce pas ?"
"She decided to move to {{c::belgium}}.","Elle a décidé de s'installer en belgique."
"We accept {{c::checks}}.","Nous acceptons les chèques."
"I've got {{c::bills}} to pay.","J'ai des factures à payer."
"I'm a very sensitive and {{c::emotional}} person.","Je suis quelqu'un de très sensible et émotif."
"He lives in {{c::morocco}}.","Il vit au maroc."
"I'm very busy these days!","Je suis très occupé ces {{c::temps-ci}} !"
"I'm very busy these days.","Je suis très occupé ces {{c::temps-ci}} !"
"He ripped his shirt open.","Il a {{c::arraché}} sa chemise."
"Her {{c::election}} is in the bag.","Son élection est dans la poche."
"I don't need a car. i am the car.","Je n'ai pas besoin {{c::d'une}} voiture. je suis la voiture."
"He returned to japan.","Il {{c::retourna}} au japon."
"You must not make {{c::noises}} in the classroom.","Vous ne devez pas faire de bruit en classe."
"The city was {{c::founded}} in 573.","La ville a été fondée en 573."
"The city was founded in 573.","La ville a été {{c::fondée}} en 573."
"The {{c::thunder}} frightened the students.","Le tonnerre effraya les étudiants."
"How many {{c::museums}} did you visit?","Tu as visité combien de musées ?"
"Tom has been in the hospital since christmas {{c::eve}}.","Tom est à l'hôpital depuis la veille de noël."
"She talked to the {{c::chairperson}}.","Elle a parlé avec le président."
"The {{c::waves}} swallowed up the boat.","Les vagues engloutirent le bateau."
"I'm indebted to you.","J'ai une {{c::dette}} envers vous."
"{{c::harry}} is only 40.","Harry n'a que 40 ans."
"I have not seen him lately.","Je ne l'ai pas vu ces {{c::derniers}} temps."
"He {{c::declared}} that he was innocent.","Il a déclaré être innocent."
"I believe that his action was in the right.","Je crois que son {{c::action}} était la bonne."
"Tom is probably still alone.","Tom est {{c::sûrement}} encore seul."
"They won't have arrived yet.","Ils ne seront pas encore {{c::arrivés}}."
"I had no idea you {{c::collected}} stamps.","Je n'avais pas idée que vous collectionniez les timbres."
"He is {{c::absorbed}} in the study of latin.","Il est plongé dans les cours de latin."
"What is the {{c::main}} purpose of this plan?","Quel est le but principal de ce plan ?"
"The lawyer is her brother.","{{c::l'avocat}} est son frère."
"He looked at the ship through his {{c::telescope}}.","Il regarda le navire avec le télescope."
"He handed in his {{c::resignation}}.","Il a remis sa démission."
"He handed in his resignation.","Il a remis sa {{c::démission}}."
"What is the {{c::central}} aim of this plan?","Quel est le but central de ce plan ?"
"I have tickets to sell.","J'ai des {{c::tickets}} à vendre."
"He tendered his resignation.","Il a présenté sa {{c::démission}}."
"He was having trouble {{c::believing}} it.","Il avait du mal à le croire."
"He accomplished his mission.","Il a {{c::accompli}} sa mission."
"Tom knocked {{c::louder}}.","Tom a frappé plus fort."
"I am not as young as miss brown.","Je ne suis pas aussi jeune que {{c::mademoiselle}} brown."
"{{c::zombies}} eat brains.","Les zombies mangent le cerveau."
"Is it easy to {{c::install}}?","Est-ce que c'est facile à installer ?"
"{{c::toward}} midnight, i fell asleep.","Je me suis endormi aux alentours de minuit."
"Toward midnight, i fell asleep.","Je me suis endormi aux {{c::alentours}} de minuit."
"This text is hard to read.","Ce {{c::texte}} est difficile à lire."
"A bird has {{c::wings}}.","Un oiseau a des ailes."
"A bird has wings.","Un oiseau a des {{c::ailes}}."
"I want to get a {{c::satisfactory}} explanation for your conduct.","Je veux une explication satisfaisante de ta conduite."
"I have come so that you can {{c::inform}} me.","Je suis venu pour que vous puissiez m'informer."
"We're {{c::pupils}}.","Nous sommes étudiants."
"He {{c::swallowed}} his pride.","Il a ravalé sa fierté."
"We don't do things by half {{c::measures}}.","Nous ne faisons pas les choses à moitié."
"I don't have to worry about {{c::finding}} a job.","Je n'ai pas à m'inquiéter de trouver un nouveau travail."
"I'm often {{c::compared}} to my brothers.","Je suis souvent comparé à mes frères."
"There is no {{c::necessity}} for you to do that.","Il n'est pas nécessaire que vous fassiez ça."
"I thought we talked about this already.","Je pensais que nous avions déjà {{c::discuté}} de ça."
"How long does a spider live?","Combien de temps vit une {{c::araignée}} ?"
"Do we have a deal?","Sommes-nous {{c::parvenus}} à un accord ?"
"Tom has {{c::gained}} weight.","Tom a pris du poids."
"The book was {{c::published}} in 1689.","Le livre fut publié en 1689."
"The book was published in 1689.","Le livre fut {{c::publié}} en 1689."
"I was instantly attracted to her.","Je fus tout de suite {{c::attiré}} par elle."
"{{c::james}} felt insecure.","James ne se sentait pas sûr de lui."
"We have two television {{c::sets}}.","Nous avons deux postes de télévision."
"My {{c::car's}} dirty.","Ma voiture est sale."
"The devil finds work for {{c::idle}} hands.","L'oisiveté est mère de tous les vices."
"Unfortunately, i can't accept your invitation.","Malheureusement, je ne peux pas accepter votre {{c::invitation}}."
"This book {{c::contains}} a lot of photos.","Ce livre contient beaucoup de photos."
"But what do you think of that new album?","Mais que pensez-vous de ce nouvel {{c::album}} ?"
"Victory is unlikely but not impossible.","La victoire est {{c::improbable}} mais pas impossible."
"The train brings the {{c::coal}} to the factory.","Le train amène le charbon à l'usine."
"The train brings the coal to the factory.","Le train amène le {{c::charbon}} à l'usine."
"It cost an arm and a leg.","Ça a {{c::coûté}} un bras."
"It's a {{c::minor}} problem.","C'est un problème mineur."
"You don't think he has many faults?","Tu ne {{c::trouves}} pas qu'il a beaucoup de défauts ?"
"How {{c::convenient}}!","Voilà qui est commode !"
"The {{c::candles}} made the room bright.","Les bougies éclairaient la pièce."
"Tell me all the details.","{{c::faites-moi}} part de tous les détails !"
"What is the weather for tomorrow?","Quelle est la {{c::météo}} pour demain ?"
"I don't like his taste in color.","Je n'aime pas ses {{c::goûts}} en matière de couleurs."
"We need new {{c::batteries}}.","Nous avons besoin de batteries neuves."
"John drank many {{c::bottles}} of wine.","Jean a bu beaucoup de bouteilles de vin."
"John drank many bottles of wine.","Jean a bu beaucoup de {{c::bouteilles}} de vin."
"Do you like {{c::robots}}?","Est-ce que vous aimez les robots ?"
"He didn't light any {{c::candles}} in his room.","Il n'allumait pas de bougies dans sa chambre."
"What's my prize?","Quelle est ma {{c::récompense}} ?"
"She died last night.","Elle est {{c::décédée}} la nuit dernière."
"I love the {{c::colors}}.","J'aime les couleurs."
"I love the colors.","J'aime les {{c::couleurs}}."
"Tom was all {{c::smiles}}.","Tom était tout sourire."
"I {{c::generally}} agree with her.","En général je suis d'accord avec elle."
