"English","French"
"Ziri has good {{c::teeth}}.","Ziri a de bonnes dents."
"The door is made of {{c::steel}}.","La porte est en acier."
"What is the capital of {{c::greece}}?","Quelle est la capitale de la grèce ?"
"What is the capital of greece?","Quelle est la capitale de la {{c::grèce}} ?"
"The bus is broken!","Le bus est en {{c::panne}} !"
"The woman has beautiful {{c::cheeks}}.","La femme a de belles joues."
"The woman has beautiful cheeks.","La femme a de belles {{c::joues}}."
"What's the capital city of {{c::finland}}?","Quelle est la capitale de la finlande ?"
"Tom refused to sign the document.","Tom refusa de signer le {{c::document}}."
"Earth is a {{c::planet}}.","La terre est une planète."
"Earth is a planet.","La terre est une {{c::planète}}."
"I know what i said.","Je sais ce que {{c::j’ai}} dit."
"He {{c::mentioned}} it.","Il l'a mentionné."
"He mentioned it.","Il l'a {{c::mentionné}}."
"I saw the game.","J'ai vu le {{c::match}}."
"He cleaned it up.","Il l'a {{c::nettoyé}}."
"{{c::yanni}} arrived.","Yanni est arrivé."
"Yanni arrived.","{{c::yanni}} est arrivé."
"Tom {{c::cooks}} for us.","Tom cuisine pour nous."
"That's a big one.","{{c::c'en}} est un grand."
"I am going to milk the {{c::cows}}.","Je vais traire les vaches."
"It wouldn't {{c::cost}} much.","Ça ne coûterait pas grand-chose."
"How deep is the pool?","Quelle est la {{c::profondeur}} de la piscine ?"
"Water is important.","L'eau est {{c::importante}}."
"I {{c::taught}} french.","J'ai enseigné le français."
"I taught french.","J'ai {{c::enseigné}} le français."
"He's {{c::everybody's}} friend.","Il est l'ami de tout le monde."
"I have to repair the {{c::refrigerator}}.","Il faut que je répare le réfrigérateur."
"Bread has gone up ten yen in price.","Le pain a {{c::augmenté}} de 10 yens."
"The price of bread {{c::rose}} by ten yen.","Le pain a augmenté de 10 yens."
"The price of bread rose by ten yen.","Le pain a {{c::augmenté}} de 10 yens."
"Tom won the {{c::costume}} contest.","Tom gagnait le concours de déguisements."
"We did not expect that!","On ne {{c::s'attendait}} pas à ça !"
"I couldn't restrain myself.","Je n'ai pas pu me {{c::retenir}}."
"The drug problem is {{c::international}}.","Le problème de la drogue est international."
"Tom was up all night.","Tom {{c::n’a}} pas dormi de la nuit."
"I loved french.","J'ai {{c::adoré}} le français."
"It was a group {{c::effort}}.","C'était un effort de groupe."
"It was a group effort.","C'était un {{c::effort}} de groupe."
"Tom is {{c::elected}} president.","Tom est élu président."
"Tom is elected president.","Tom est {{c::élu}} président."
"I wasn't able to {{c::defend}} myself.","Je n'ai pas pu me défendre."
"I wasn't able to defend myself.","Je n'ai pas pu me {{c::défendre}}."
"I must translate the {{c::sentences}}.","Je dois traduire les phrases."
"I must translate the sentences.","Je dois {{c::traduire}} les phrases."
"I'm {{c::stronger}} now.","Je suis plus fort, désormais."
"He {{c::humiliated}} her.","Il l'a humiliée."
"Tom {{c::needn't}} do it.","Tom n'a pas à faire ça."
"Tom came back from australia.","Tom est revenu {{c::d'australie}}."
"He {{c::hugged}} her.","Il l'a enlacée."
"He has a cold.","Il a {{c::attrapé}} froid."
"I saw the {{c::file}}.","J'ai vu le fichier."
"I saw the file.","J'ai vu le {{c::fichier}}."
"I want things to change.","Je veux que les choses {{c::changent}}."
"I think you're interesting.","Je pense que tu es {{c::intéressante}}."
"I will give you a ride home.","Je vais vous {{c::ramener}} à la maison."
"It's a {{c::pleasure}} to meet you.","C'est un plaisir de vous rencontrer."
"We're stalled.","Nous sommes à {{c::l'arrêt}}."
"Green is the color of money.","Le {{c::vert}} est la couleur de l'argent."
"I wasn't scared at all.","Je n'étais pas du tout {{c::effrayée}}."
"France is a {{c::republic}}.","La france est une république."
"France is a republic.","La france est une {{c::république}}."
"Tom is my {{c::brother's}} friend.","Tom est l'ami de mon frère."
"He is {{c::independent}} of his parents.","Il est indépendant de ses parents."
"The {{c::doctor's}} on his way.","Le docteur est en chemin."
"I saw the file.","J'ai vu le {{c::dossier}}."
"I know it's not healthy.","Je sais que ce n'est pas {{c::sain}}."
"You will go to school.","Tu {{c::iras}} à l'école."
"The number of tourists has {{c::increased}}.","Le nombre de touristes a augmenté."
"Tourists have {{c::increased}} in number.","Le nombre de touristes a augmenté."
"We'll have plenty of time.","Nous {{c::aurons}} beaucoup de temps."
"I know what they are thinking.","Je sais ce qu'elles {{c::pensent}}."
"I'm more than a friend.","Je suis plus {{c::qu'une}} amie."
"I told you to sign the document.","Je t'ai dit de signer le {{c::document}}."
"The face is the mirror of the soul.","Le visage est le miroir de {{c::l'âme}}."
"They're not dead.","Elles ne sont pas {{c::mortes}}."
"He has 12 sons.","Il a {{c::douze}} fils."
"They are not tired.","Elles ne sont pas {{c::fatiguées}}."
"Japan is in {{c::asia}}.","Le japon est en asie."
"Would you like some {{c::potato}} soup?","Aimeriez-vous de la soupe de pommes de terre ?"
"I work out {{c::whenever}} i can.","Je m'exerce chaque fois que je peux."
"They're harmless.","Elles ne sont pas {{c::dangereuses}}."
"Tom is obviously very brave.","Tom est {{c::évidemment}} courageux."
"I just needed some water.","Il ne me {{c::fallait}} que de l'eau."
"Water is {{c::liquid}}.","L'eau est liquide."
"I need more gold.","J'ai besoin de plus {{c::d'or}}."
"Tom {{c::appeared}} suddenly.","Tom est apparu soudainement."
"Tom didn't complain about anything.","Tom ne s'est {{c::plaint}} de rien."
"He answered as {{c::follows}}.","Il a répondu ainsi."
"I loved the book.","J'ai {{c::adoré}} le livre."
"Tell him to mind his own business.","Dis-lui de {{c::s'occuper}} de ses affaires."
"Water is {{c::amazing}}.","L'eau est merveilleuse."
"Water is amazing.","L'eau est {{c::merveilleuse}}."
"{{c::mars}} is the god of war.","Mars est le dieu de la guerre."
"Mars is the god of war.","{{c::mars}} est le dieu de la guerre."
"Is that a picture of me?","Est-ce une {{c::image}} de moi ?"
"The {{c::vase}} fell from the table.","Le vase est tombé de la table."
"The vase fell from the table.","Le {{c::vase}} est tombé de la table."
"He is popular with his men.","Il est aimé de ses {{c::hommes}}."
"Tom is my {{c::son's}} friend.","Tom est l'ami de mon fils."
