"English","French"
"He buys cigarettes.","Il achète des {{c::cigarettes}}."
"I had met him many times before then.","Je l'avais rencontré à de nombreuses {{c::reprises}} auparavant."
"Do you have psychic {{c::powers}}?","Êtes-vous doté de pouvoirs psychiques ?"
"He {{c::grabbed}} my arm.","Il a saisi mon bras."
"The apple is not yet {{c::ripe}}.","La pomme n'est pas encore mûre."
"Did i {{c::blow}} it?","Est-ce que j'ai vendu la mèche ?"
"He is our teacher of english.","Il est notre professeur {{c::d'anglais}}."
"I stepped in the mud.","J'ai marché dans la {{c::boue}}."
"This {{c::website}} seems quite good.","Ce site a l'air pas mal."
"This website seems quite good.","Ce {{c::site}} a l'air pas mal."
"I like the color orange.","J'aime la couleur {{c::orange}}."
"My french is {{c::limited}}.","Mon français est limité."
"Why don't you {{c::loosen}} up?","Pourquoi ne te laisses-tu pas aller ?"
"She used to live in {{c::luxury}}.","Elle vivait dans le luxe."
"The piano has a good tone.","Le piano a un bon {{c::timbre}}."
"Can you make the deadline?","Pouvez-vous tenir le {{c::délai}} ?"
"This {{c::bowl}} of soup will be enough.","Ce bol de soupe me suffira."
"Do you play a musical {{c::instrument}}?","Jouez-vous d'un instrument de musique ?"
"She is {{c::absorbed}} in rock music.","Elle baigne dans le rock."
"This is the {{c::passage}} to the sea.","C'est le passage vers la mer."
"This is the passage to the sea.","C'est le {{c::passage}} vers la mer."
"That's still a matter of debate.","Cela reste un sujet de {{c::débat}}."
"Tom assigned mary to do the job.","Tom a {{c::chargé}} mary de faire le boulot."
"{{c::poland}} is not yet lost.","La pologne n'est pas encore perdue."
"I want to understand {{c::humans}}.","Je veux comprendre les êtres humains."
"I want to understand humans.","Je veux comprendre les {{c::êtres}} humains."
"Did you come from a {{c::musical}} family?","Viens-tu d'une famille de musiciens ?"
"Do you like your classmates?","Aimes-tu tes {{c::camarades}} de classe ?"
"He's never seen a play.","Il n'a jamais vu de pièce de {{c::théâtre}}."
"I don't think you really want to know.","Je ne pense pas que tu {{c::veuilles}} vraiment savoir."
"The house burned down completely.","La maison était en {{c::cendres}}."
"You're the last hope for {{c::humanity}}.","Tu es le dernier espoir de l'humanité."
"She made a {{c::scene}}.","Elle a fait une scène."
"You are to observe traffic rules.","Tu dois respecter le {{c::code}} de la route."
"The {{c::t-shirt}} isn't clean enough.","Le t-shirt n'est pas assez propre."
"The t-shirt isn't clean enough.","Le {{c::t-shirt}} n'est pas assez propre."
"This {{c::handbag}} is mine.","Ce sac à main est à moi."
"The house was in {{c::flames}}.","La maison était en flammes."
"The fire started in tom's room.","{{c::l'incendie}} a pris dans la chambre de tom."
"There is no reason for this fear.","Il n'y a pas de raison à cette {{c::crainte}}."
"Please keep in touch.","Veuillez garder le {{c::contact}}."
"The {{c::mass}} has not yet been said.","La messe n'est pas encore dite."
"Tom doesn't eat between {{c::meals}}.","Tom ne mange pas entre les repas."
"Tom got the ticket for free.","Tom a eu le ticket {{c::gratuitement}}."
"It's the {{c::happiest}} place on earth!","C'est l'endroit le plus heureux de la terre !"
"That {{c::sounded}} good.","Ça a l'air bien."
"What do you usually do on mondays?","Que fais-tu en {{c::général}} le lundi ?"
"This device produces electricity.","Cet appareil produit de {{c::l'électricité}}."
"It's the peak of {{c::hurricane}} season.","C'est le pic de la saison des ouragans."
"I lived in {{c::poverty}}.","J'ai vécu dans la pauvreté."
"I lived in poverty.","J'ai vécu dans la {{c::pauvreté}}."
"They don't make you happy.","Ils ne te {{c::rendent}} pas heureux."
"He touched my shoulder.","Il a touché mon {{c::épaule}}."
"She has a nice face.","Elle a un {{c::air}} sympa."
"If you want to, we'll go.","Si vous le voulez, nous {{c::partirons}}."
"They don't take care of that dog.","Elles ne {{c::prennent}} pas soin de ce chien."
"{{c::although}} i was exhausted, i continued to work.","Bien que je fusse épuisé, je continuais à travailler."
"She married an american.","Elle a {{c::épousé}} un américain."
"Could you kill someone?","{{c::seriez-vous}} capable de tuer quelqu'un ?"
"I'm in {{c::total}} agreement with you.","Je suis tout à fait d'accord avec vous."
"The budget does not allow for this expenditure.","Le {{c::budget}} ne permet pas cette dépense."
"Tom has a {{c::frog}} in his throat.","Tom a un chat dans la gorge."
"The {{c::sooner}}, the better.","Le plus tôt sera le mieux."
"What's the {{c::spelling}} of your family name?","Quelle est l'orthographe de votre nom de famille ?"
"{{c::something's}} wrong here.","Quelque chose ne va pas ici."
"Tom is at the shopping center.","Tom est au centre {{c::commercial}}."
"That's your {{c::favorite}}, right?","C'est votre préférée, n'est-ce pas ?"
"That's your favorite, right?","C'est votre {{c::préférée}}, n'est-ce pas ?"
"She married a {{c::sailor}}.","Elle a épousé un marin."
"You want to talk about this {{c::event}}?","Tu veux parler de cet événement ?"
"You want to talk about this event?","Tu veux parler de cet {{c::événement}} ?"
"I'm sorry, we don't accept {{c::checks}}.","Je suis désolé, nous n'acceptons pas les chèques."
"She {{c::tortured}} a prisoner.","Elle a torturé un prisonnier."
"She has a tight schedule.","Elle a un {{c::horaire}} chargé."
"The {{c::kitten}} wanted in.","Le chaton voulait entrer."
"Tom {{c::offered}} to lend me the money.","Tom a offert de me prêter l'argent."
"Please open the package.","Veuillez ouvrir le {{c::colis}}."
"He talked to the {{c::chairman}}.","Il a parlé au président."
"It's difficult to {{c::predict}} the outcome of the election.","Il est difficile de prévoir les résultats de l'élection."
"Why didn't you come to the party?","Pourquoi n'êtes-vous pas {{c::venus}} à la fête ?"
"It is {{c::vital}} that you be present.","Il est vital que vous soyez présent."
"Why didn't you come to the party?","Pourquoi n'êtes-vous pas {{c::venues}} à la fête ?"
"I can't believe i used to watch this show.","Je n'arrive pas à croire que je regardais cette {{c::émission}}."
"I don't {{c::slice}} their bread.","Je ne coupe pas leur pain en tranches."
"{{c::cotton}} sucks up water.","Le coton absorbe l'eau."
"The {{c::doors}} of the house were red.","Les portes de la maison étaient rouges."
"He decided to put off his {{c::departure}}.","Il a décidé de reporter son départ."
"I think my job is {{c::pointless}}.","Je pense que mon emploi est dénué de sens."
"They arrived at the hotel.","Ils {{c::arrivèrent}} à l'hôtel."
"It is {{c::vital}} that you be present.","Il est vital que vous soyez présente."
"I won't go, {{c::unless}} the rain stops.","Je n'irai pas, à moins que la pluie ne s'arrête."
"Do you have a fishing {{c::license}}?","Disposez-vous d'un permis de pêche ?"
"What happened to you, {{c::dear}} friend?","Que vous arrive-t-il, cher ami ?"
"It is {{c::vital}} that you be present.","Il est vital que vous soyez présents."
"You must learn to {{c::adapt}}.","Vous devez apprendre à vous adapter."
"I don't have any information on that subject.","Je n'ai aucune {{c::information}} à ce sujet."
"Suddenly it began to rain.","{{c::soudain}} il a commencé à pleuvoir."
"Here is their photo album.","Voici leur {{c::album}} de photos."
"He was wise not to participate in it.","Il a été {{c::avisé}} de ne pas y participer."
"The rest follows naturally.","Le reste suit {{c::naturellement}}."
