"English","French"
"I prefer giving gifts to {{1::receiving}} them.","Je préfère donner des cadeaux que de les recevoir."
"I like stories.","J'aime les {{1::histoires}}."
"Mennad is in {{1::cairo}}.","Mennad est au caire."
"Mennad is in cairo.","Mennad est au {{1::caire}}."
"She has her eyes closed.","Elle a les yeux {{1::fermés}}."
"It was nice of you to offer.","C'est gentil de me l'avoir {{1::proposé}}."
"I like {{1::cities}}.","J'aime les villes."
"She {{1::lowered}} her eyes.","Elle a baissé les yeux."
"I got my ears {{1::pierced}}.","Je me suis fait percer les oreilles."
"Don't let this chance slip by.","Ne laisse pas passer cette {{1::opportunité}}."
"I got injured doing that.","Je me suis blessé en {{1::faisant}} ça."
"We don't know what the next day will bring.","Nous ne savons pas de quoi le {{1::lendemain}} est fait."
"Let's not stay here long.","Ne {{1::restons}} pas ici trop longtemps."
"We've {{1::discussed}} this.","Nous en avons discuté."
"We've discussed this.","Nous en avons {{1::discuté}}."
"The {{1::germans}} are starting to have doubts about europe.","Les allemands commencent à douter de l'europe."
"He lives in cairo.","Il habite au {{1::caire}}."
"He lives in {{1::morocco}}.","Il habite au maroc."
"The police were able to {{1::verify}} tom's alibi.","La police a pu vérifier l'alibi de tom."
"He {{1::treats}} me as a child.","Il me traite en enfant."
"He {{1::treats}} me like a child.","Il me traite en enfant."
"I advised my {{1::pupils}} not to smoke.","J'ai conseillé à mes élèves de ne pas fumer."
"I like cake.","J'aime les {{1::gâteaux}}."
"The society was {{1::founded}} in 1990.","La société a été fondée en 1990."
"The society was founded in 1990.","La société a été {{1::fondée}} en 1990."
"But i don't really {{1::profit}} from it.","Mais je n'en tire pas vraiment profit."
"The {{1::troops}} had plenty of arms.","Les troupes avaient beaucoup de bras."
"I love trips.","J'aime les {{1::voyages}}."
"I like trips.","J'aime les {{1::voyages}}."
"I'm glad you {{1::reminded}} me.","Je suis content que vous me l'ayez rappelé."
"I'm capable of making my own {{1::decisions}}.","Je suis capable de faire mes propres choix."
"This is a recipe for {{1::disaster}}.","C'est la recette du désastre."
"This news is {{1::official}}.","Cette nouvelle est officielle."
"I like {{1::butterflies}}.","J'aime les papillons."
"I like butterflies.","J'aime les {{1::papillons}}."
"I have a sweet-tooth.","J'aime les {{1::bonbons}}."
"I like sweets.","J'aime les {{1::bonbons}}."
"I got injured doing that.","Je me suis blessée en {{1::faisant}} ça."
"There is no {{1::electricity}} in the room.","Il n'y a pas d'électricité dans la chambre."
"We have medicine for you.","Nous avons un {{1::médicament}} pour vous."
"I have some errands to run.","J'ai quelques {{1::emplettes}} à faire."
"There's a secret {{1::passage}}.","Il y a un passage secret."
"There's a secret passage.","Il y a un {{1::passage}} secret."
"I love {{1::turtles}}.","J'aime les tortues."
"I like {{1::mushrooms}}.","J'aime les champignons."
"It's bad luck to say that.","Ça porte {{1::malheur}} de dire ça."
"I like the {{1::dresses}}.","J'aime les robes."
"I love {{1::kittens}}!","J'aime les chatons !"
"When do the christmas holidays begin?","Quand {{1::commencent}} les vacances de noël ?"
"She has short hair.","Elle a les cheveux {{1::courts}}."
"Peace to his {{1::ashes}}!","Paix à ses cendres !"
"Peace to his ashes!","Paix à ses {{1::cendres}} !"
"I need a few more days.","Il me faut {{1::quelques}} jours de plus."
"That's what {{1::interests}} me.","C'est ce qui m'intéresse."
"Do you have a {{1::condom}}?","Est-ce que tu as un préservatif ?"
"I don't want to live by your rules.","Je ne veux pas vivre {{1::selon}} tes règles."
"I know what you {{1::could've}} done.","Je sais ce que tu aurais pu faire."
"It was something i didn't expect.","C'était quelque chose {{1::auquel}} je ne m'attendais pas."
"The {{1::pupils}} burst out laughing.","Les élèves ont éclaté de rire."
"Tom has no insurance.","Tom ne possède aucune {{1::assurance}}."
"I had two {{1::copies}} of the book.","J'avais deux copies de ce livre."
"What is the number of {{1::countries}} in europe?","Quel est le nombre de pays en europe ?"
"I saw tom's reaction in the mirror.","J'ai vu la {{1::réaction}} de tom dans le miroir."
"The leaves have changed {{1::colors}}.","Les feuilles ont changé de couleurs."
"The leaves have changed {{1::colours}}.","Les feuilles ont changé de couleurs."
"It's not {{1::higher}} math.","Il faut pas sortir de polytechnique pour le comprendre."
"She talked to the {{1::chairperson}}.","Elle a parlé avec la présidente."
"Algerians want freedom.","Les {{1::algériens}} veulent la liberté."
"{{1::muslims}} watch tv.","Les musulmans regardent la télévision."
"I stuck to my {{1::principles}}.","Je suis resté fidèle à mes principes."
"I stuck to my principles.","Je suis resté fidèle à mes {{1::principes}}."
"It was handcrafted.","On {{1::l'avait}} fait à la main."
"The kids are asleep.","Les enfants {{1::dorment}}."
"He is {{1::merely}} a child.","C'est seulement un enfant."
"I want to look like her.","Je veux avoir le même {{1::air}} qu'elle."
"He showed a lot of {{1::skill}}.","Il a montré beaucoup d'habileté."
"He didn't reveal his secret.","Il n'a pas {{1::révélé}} son secret."
"They arrived at the hotel.","Elles {{1::arrivèrent}} à l'hôtel."
"He entered the hall of {{1::fame}}.","Il entra au panthéon."
"You deserve a {{1::medal}}.","Tu mérites une médaille."
"We're different.","Nous sommes {{1::différentes}}."
"I don't like your taste in colors.","Je n'aime pas tes {{1::goûts}} en matière de couleurs."
"I've got real feelings for you.","J'ai de {{1::vrais}} sentiments à votre égard."
"This is a happy occasion.","C'est un heureux {{1::événement}}."
"Beer {{1::bottles}} are made of glass.","Les bouteilles de bière sont faites de verre."
"Beer bottles are made of glass.","Les {{1::bouteilles}} de bière sont faites de verre."
"Listen carefully to what i am going to tell you.","Écoutez {{1::soigneusement}} ce que je vais vous dire."
"A rabbit has long ears.","Les {{1::lapins}} ont de grandes oreilles."
"I don't like your taste in colors.","Je n'aime pas vos {{1::goûts}} en matière de couleurs."
"This table isn't {{1::steady}}.","Cette table est bancale."
"He {{1::greeted}} his parents.","Il a salué ses parents."
"You'll have to ask tom that.","Tu {{1::devras}} demander cela à tom."
"We are human.","Nous sommes {{1::humains}}."
"We still have to look for the {{1::hook}}.","Il nous reste à chercher l'hameçon."
"Tom is now a {{1::businessman}}.","Tom est maintenant homme d'affaire."
"The magazine is aimed at {{1::teenagers}}.","Le magazine est à destination des adolescents."
"The magazine is aimed at teenagers.","Le magazine est à destination des {{1::adolescents}}."
"The first {{1::blow}} is half the battle.","La première frappe, c'est la moitié de la bataille."
"Her {{1::behaviour}} is strange.","Son comportement est étrange."
"{{1::louder}}.","Plus fort."
