"English","French"
"Algeria is in {{c::crisis}}.","L'algérie est en crise."
"Algeria is in crisis.","L'algérie est en {{c::crise}}."
"See you in two weeks.","À dans deux {{c::semaines}}."
"He wrapped his arms around her {{c::waist}}.","Il lui enlaça la taille."
"Do you have any {{c::pets}}?","Avez-vous des animaux de compagnie ?"
"Don't {{c::lean}} against the wall.","Ne vous appuyez pas contre le mur."
"The roof of the church needs {{c::repairs}}.","Le toit de l'église a besoin de réparations."
"The dog couldn't bark.","Le chien ne pouvait {{c::aboyer}}."
"I'll send you a {{c::postcard}} from boston.","Je t'enverrai une carte postale de boston."
"The house has been left to go to {{c::ruin}}.","La maison est laissée à l'abandon."
"She died of natural {{c::causes}}.","Elle est morte de mort naturelle."
"She died of natural causes.","Elle est morte de mort {{c::naturelle}}."
"Salt is {{c::essential}} to life.","Le sel est essentiel à la vie."
"Who {{c::invented}} the telephone?","Qui inventa le téléphone ?"
"Music is her {{c::passion}}.","La musique est sa passion."
"Music is her passion.","La musique est sa {{c::passion}}."
"George weighs not less than 70 {{c::kilograms}}.","Georges pèse pas moins de 70 kilogrammes."
"The pain has started to {{c::ease}} now.","La douleur commence à s'estomper."
"He caught an {{c::overnight}} train.","Il a pris un train de nuit."
"Algeria is in {{c::africa}}.","L'algérie est en afrique."
"Algeria is in africa.","L'algérie est en {{c::afrique}}."
"He {{c::squeezed}} her leg.","Il lui étreignit la jambe."
"Excuse me, where is the {{c::metro}}?","Excusez-moi, où est le métro ?"
"The man answers the {{c::description}}.","L'homme correspond à la description."
"The man fits the {{c::description}}.","L'homme correspond à la description."
"Why don't you {{c::consult}} a lawyer?","Pourquoi ne pas consulter un avocat ?"
"Why don't you consult a lawyer?","Pourquoi ne pas {{c::consulter}} un avocat ?"
"He will have to go to the station.","Il {{c::devra}} aller à la gare."
"He'll have to go to the station.","Il {{c::devra}} aller à la gare."
"He never woke up.","Il ne se {{c::réveilla}} jamais."
"I've got a good reason not to like tom.","J'ai de bonnes raisons de ne pas {{c::apprécier}} tom."
"I don't think this is for you.","Je ne pense pas que ce {{c::soit}} pour vous."
"He {{c::turns}} everything to good account.","Il fait feu de tout bois."
"Why don't you {{c::consult}} a lawyer?","Pourquoi ne consultes-tu pas un avocat ?"
"Europe is in {{c::crisis}}.","L'europe est en crise."
"I think i'll leave this group.","Je pense que je vais quitter ce {{c::groupe}}."
"I'm not going to sue you.","Je ne vais pas vous {{c::poursuivre}} en justice."
"Do you have any rock {{c::cds}}?","As-tu des cds de rock ?"
"You can't cancel the meeting.","Vous ne pouvez pas {{c::annuler}} la réunion."
"I will not buy this record, it is {{c::scratched}}.","Je n'achèterai pas ce disque, il est rayé."
"He has his father's eyes.","Il a les {{c::yeux}} de son père."
"Where's the shopping center?","Où est le centre {{c::commercial}} ?"
"The temperature {{c::begins}} to drop.","La température commence à chuter."
"I hope that's {{c::satisfactory}}.","J'espère que c'est satisfaisant."
"He never {{c::loses}} his head.","Il ne perd jamais la tête."
"The sentence is free from {{c::grammatical}} mistakes.","La phrase ne contient pas de faute de grammaire."
"Yes, i did this {{c::intentionally}}.","Oui, je l'ai fait exprès."
"I just keep finding {{c::excuses}}.","Je ne fais que trouver des excuses."
"I can't express my feelings.","Je ne parviens pas à {{c::exprimer}} ce que je ressens."
"I'd like orange juice.","Je voudrais du jus {{c::d'orange}}."
"They have just prepared the {{c::meal}}.","Ils viennent de préparer le repas."
"She lives like a {{c::princess}}.","Elle a un train de vie de princesse."
"She lives like a princess.","Elle a un train de vie de {{c::princesse}}."
"You must not stay up late.","Vous ne devez pas {{c::veiller}} tard."
"I didn't want that to happen.","Je ne voulais pas que cela se {{c::produise}}."
"The {{c::basket}} was full of apples.","Le panier était plein de pommes."
"The basket was full of apples.","Le {{c::panier}} était plein de pommes."
"I'm {{c::thankful}} for technology.","Je suis reconnaissant de pouvoir disposer de la technologie."
"I'm thankful for technology.","Je suis reconnaissant de pouvoir disposer de la {{c::technologie}}."
"I am no better than a {{c::beggar}}.","Je ne vaux pas mieux qu'un mendiant."
"I'm no better than a {{c::beggar}}.","Je ne vaux pas mieux qu'un mendiant."
"I lied {{c::constantly}} to my wife.","Je mentais constamment à ma femme."
"The city was covered in snow.","La ville était {{c::couverte}} de neige."
"He lives in england.","Il habite en {{c::angleterre}}."
"Tom pretends he doesn't understand french.","Tom {{c::prétend}} ne pas comprendre le français."
"I am content with my current position.","Je suis content de ma situation {{c::actuelle}}."
"I'm content with my current position.","Je suis content de ma situation {{c::actuelle}}."
"How many digits does that number have?","Combien de {{c::chiffres}} a ce nombre ?"
"I see life {{c::differently}} now.","Désormais, je vois la vie autrement."
"{{c::inflation}} is down.","L'inflation est en baisse."
"You deserve a salary {{c::hike}}.","Vous méritez une augmentation de salaire."
"Are you going to take part in the contest?","Vas-tu participer à la {{c::compétition}} ?"
"I didn't know that at the time.","Je ne savais pas cela à cette {{c::époque}}."
"I like the color of your {{c::skirt}}.","J'aime la couleur de votre jupe."
"I like the color of your skirt.","J'aime la couleur de votre {{c::jupe}}."
"Do you like {{c::roses}}?","Vous aimez les roses ?"
"I'd like to cancel my ticket.","Je voudrais {{c::annuler}} mon billet."
"I can't spend money i don't have.","Je ne peux pas {{c::dépenser}} l'argent que je n'ai pas."
"It's thirty kilometers away.","C'est à trente {{c::kilomètres}}."
"One of my {{c::suitcases}} is missing.","Une de mes valises a disparu."
"One of my suitcases is missing.","Une de mes {{c::valises}} a disparu."
"I have a job i have to do.","J'ai un boulot à {{c::effectuer}}."
"I must seize this opportunity.","Je dois {{c::saisir}} cette opportunité."
"They didn't know what to do with him.","Elles ne {{c::savaient}} que faire de lui."
"I don't believe they understood.","Je ne crois pas qu'ils {{c::aient}} compris."
"Is the flight on schedule?","Est-ce que le {{c::vol}} est à l'air ?"
"George was the highlight of the evening.","{{c::george}} était le clou de la soirée."
"That's not very {{c::original}}.","Ce n'est pas très original."
"He {{c::laid}} out this garden.","Il a dessiné ce jardin."
"{{c::stupidity}} is no excuse.","La stupidité n'est pas une excuse."
"India is in {{c::asia}}.","L'inde est en asie."
"They're able to sing.","Ils sont {{c::capables}} de chanter."
"The room was {{c::crowded}} with furniture.","La chambre était pleine de meubles."
"The room was crowded with furniture.","La chambre était pleine de {{c::meubles}}."
"{{c::fasten}} the rope to the tree.","Attache la corde à l'arbre."
"{{c::fasten}} the rope to the tree.","Attachez la corde à l'arbre !"
"Tom's parrot swears in french.","Le {{c::perroquet}} de tom jure en français."
"I would like a can of diet {{c::coke}}.","Je voudrais une canette de coca-cola light."
"The bell {{c::rings}} at noon.","La cloche sonne à midi."
"Please help tom.","{{c::veuillez}} aider tom."
